{
  "schema_version": 1,
  "kind": "acceptance-build",
  "owner_login": "kim-em",
  "declared_model": "Example Model",
  "problem_id": "two_plus_two",
  "statement_revision": 1,
  "benchmark_commit": "dddddddddddddddddddddddddddddddddddddddd",
  "results_commit": "eeeeeeeeeeeeeeeeeeeeeeeeeeeeeeeeeeeeeeee",
  "toolchain": "leanprover/lean4:v4.35.0-rc3",
  "attempt": 1,
  "workflow_run_id": 123,
  "workflow_commit": "aaaaaaaaaaaaaaaaaaaaaaaaaaaaaaaaaaaaaaaa",
  "measured_at": "2026-10-22T06:00:00.000Z",
  "runner_class": "namespace-ubuntu-24.04-amd64-16x32-lake-v1",
  "architecture": "x86_64",
  "cache_state": "solution-cold-dependencies-cached",
  "components": {
    "toolchain": "aaaaaaaaaaaaaaaaaaaaaaaaaaaaaaaaaaaaaaaa",
    "bubblewrap_sha256": "bbbbbbbbbbbbbbbbbbbbbbbbbbbbbbbbbbbbbbbbbbbbbbbbbbbbbbbbbbbbbbbb"
  },
  "status": "available",
  "reason_code": null,
  "build_wall_time_ms": 1234,
  "build_retired_instructions": 3456789,
  "build_retired_instructions_unavailable_reason": null,
  "checker_wall_time_ms": 120,
  "checker_retired_instructions": null,
  "checker_retired_instructions_unavailable_reason": "counter_permission_denied",
  "result_id": "r2_80f02f892fb0b90474675aa0b572252a8758faf74b95400521e9da724583931f",
  "series": "8d0cfae405d5973e57b475e1eeef28d0ec671680d85cea7b471e9c26eb344ddb"
}
